rank,region,organization,evidence_level,fit_total,match_score,match_reason,reach_score,reach_reason,budget_score,budget_reason,cycle_score,cycle_reason,contact_name,contact_title,personal_reach_method,email,phone,linkedin_person_search_url,reachability_status,source_urls,outreach_zh_around_200_chars
24,泰国,Saha Group / Chokwatana Family Platform,C,26,6,"Chokwatana 家族消费品和工业集团资产多元，家族资本需求需验证。",6,"Boonsithi 为明确 principal，个人触达需补强。",8,"集团体量大，预算能力存在。",6,"需先确认是否有独立家族资本团队。",Boonsithi Chokwatana,Chairman / family principal,LinkedIn personal search,,,https://www.linkedin.com/search/results/people/?keywords=Boonsithi%20Chokwatana%20Saha%20Group,person_name_plus_linkedin_search_needs_profile_confirmation,https://www.sahagroup.com/ | https://en.wikipedia.org/wiki/Saha_Group,"Boonsithi 你好，Saha Group 长期经营消费品、工业和多元投资，家族层面的资产总览、外部投资和现金流报告可能分散在多个实体。Canopy 专注帮助家族办公室统一银行、券商、基金、私募和直接持股数据，建立一致的组合和风险视图。若 Chokwatana family capital team 希望提升报告效率，我希望安排 15 分钟沟通。"
25,马来西亚,Kuok Group / Kerry Family Platform,B,32,8,"郭氏家族全球资产覆盖大宗商品、地产、酒店、物流和投资，跨地域多币种复杂。",7,"Kuok family principal 需确认具体联系人；个人检索入口可用。",9,"资产体量和跨境复杂度高，预算能力强。",8,"跨地域资产天然需要统一视图，但需暖介绍。",Kuok Khoon Hong / Kuok Family Office Lead,Family principal / family capital lead,LinkedIn personal search,,,https://www.linkedin.com/search/results/people/?keywords=Kuok%20family%20office%20Kuok%20Group,person_name_plus_linkedin_search_needs_profile_confirmation,https://www.kuokgroup.com/ | https://www.kerryholdings.com/ | https://en.wikipedia.org/wiki/Robert_Kuok,"您好，Kuok family platform 横跨亚洲多个市场，资产覆盖大宗商品、地产、酒店、物流和长期投资，家族层面的跨币种和跨实体资产视图非常关键。Canopy 能整合不同托管行、券商、基金、私募和直接投资数据，形成统一资产总览。若家族资本团队希望减少分散报表和手工汇总，我希望安排 15 分钟交流。"
26,马来西亚,Hong Leong Group Malaysia / Quek Family Platform,B,31,8,"郭令灿家族金融、地产、制造和投资资产丰富，适合跨机构资产聚合。",7,"Quek Leng Chan 为明确 principal，个人检索入口可用。",9,"金融与产业资产并存，预算能力强。",7,"需通过主席办公室或家族资本团队确认采购路径。",Quek Leng Chan,Chairman / family principal,LinkedIn personal search,,,https://www.linkedin.com/search/results/people/?keywords=Quek%20Leng%20Chan%20Hong%20Leong%20Malaysia,person_name_plus_linkedin_search_needs_profile_confirmation,https://www.hongleong.com.my/ | https://en.wikipedia.org/wiki/Quek_Leng_Chan,"Mr. Quek 你好，Hong Leong Malaysia 覆盖金融服务、地产、制造和长期投资，家族资本层面的资产、风险和现金流报告需要整合多个来源。Canopy 可连接银行、券商、基金管理人、私募和直接投资数据，形成可追踪组合视图。若 Quek family office 或主席办公室正在优化资产报告流程，我希望安排 15 分钟沟通。"
27,马来西亚,Sunway Group / Jeffrey Cheah Family Platform,C,29,7,"谢富年家族地产、教育、医疗、基础设施、基金会和投资组合复杂。",7,"Jeffrey Cheah 为明确 principal，个人检索入口可用。",8,"家族资产和基金会治理预算潜力高。",7,"可从基金会/家族平台治理和报告透明度切入。",Jeffrey Cheah,Founder / Chairman,LinkedIn personal search,,,https://www.linkedin.com/search/results/people/?keywords=Jeffrey%20Cheah%20Sunway%20Group,person_name_plus_linkedin_search_needs_profile_confirmation,https://www.sunway.com.my/ | https://en.wikipedia.org/wiki/Jeffrey_Cheah,"Tan Sri Jeffrey 你好，Sunway 体系横跨地产、教育、医疗、基础设施和公益基金会，家族资本和长期影响力资产之间需要清晰、持续的报告基础。Canopy 可整合银行、券商、基金、私募和直接投资数据，形成统一资产视图。若 Sunway family platform 正在提升投资数据管理，我希望安排 15 分钟交流。"
28,马来西亚,YTL Corporation / Yeoh Family Platform,C,28,7,"杨氏家族基础设施、公用事业、地产、酒店和科技投资资产多元。",7,"Francis Yeoh 为明确 principal，个人检索入口可用。",8,"资产体量和跨行业复杂度较高。",6,"需先确认家族资本或投资办公室实际联系人。",Francis Yeoh,Executive Chairman / family principal,LinkedIn personal search,,,https://www.linkedin.com/search/results/people/?keywords=Francis%20Yeoh%20YTL,person_name_plus_linkedin_search_needs_profile_confirmation,https://www.ytl.com/ | https://en.wikipedia.org/wiki/Francis_Yeoh,"Tan Sri Francis 你好，YTL 在基础设施、公用事业、地产、酒店和科技投资上有长期布局，家族层面的资产汇总与多币种报告会涉及多个平台和管理人。Canopy 面向家族办公室，帮助统一银行、券商、基金、私募和直接投资数据，提升组合透明度。若 Yeoh family capital team 正在优化报告流程，我希望安排 15 分钟交流。"
29,马来西亚,Usaha Tegas / Ananda Krishnan Family Platform,B,28,7,"Usaha Tegas 是私人投资控股平台，电信、媒体、能源和投资资产复杂。",6,"Ananda Krishnan 为明确 principal，但个人级公开触达较弱，需 Apollo/Hunter 补。",9,"私人投资控股平台预算能力强。",6,"低公开度导致直接触达周期较长，适合暖介绍。",Ananda Krishnan / Chair Office Lead,Founder / chair office,LinkedIn personal search,,,https://www.linkedin.com/search/results/people/?keywords=Ananda%20Krishnan%20Usaha%20Tegas,person_name_plus_linkedin_search_needs_profile_confirmation,https://www.usahategas.com/ | https://en.wikipedia.org/wiki/Ananda_Krishnan,"您好，Usaha Tegas 作为私人投资控股平台，长期覆盖电信、媒体、能源和多元投资，家族资本视角下的数据整合、估值更新和跨实体报告需求明显。Canopy 可把多托管行、券商、基金、私募和直接投资项目统一到一个安全平台。若主席办公室或投资团队正在提升报告效率，我希望安排 15 分钟沟通。"
30,马来西亚,Berjaya Corporation / Vincent Tan Family Platform,C,26,6,"陈志远家族消费、地产、酒店、彩票和投资资产分散度高。",7,"Vincent Tan 为明确 principal，个人检索入口可用。",7,"资产体量较大，但独立家办主体需验证。",6,"适合先补家族资本团队联系人后跟进。",Vincent Tan,Founder / Advisor,LinkedIn personal search,,,https://www.linkedin.com/search/results/people/?keywords=Vincent%20Tan%20Berjaya,person_name_plus_linkedin_search_needs_profile_confirmation,https://www.berjaya.com/ | https://en.wikipedia.org/wiki/Vincent_Tan,"Tan Sri Vincent 你好，Berjaya 涵盖消费、地产、酒店、彩票和多元投资，家族层面的外部金融资产、直接持股和经营资产报告可能分布在多个实体。Canopy 专注为家族办公室提供统一资产聚合和组合报告，帮助减少人工汇总、提升跨机构数据透明度。若 Berjaya family capital team 正在评估更高效工具，我希望安排 15 分钟交流。"
