rank,region,organization,evidence_level,fit_total,match_score,match_reason,reach_score,reach_reason,budget_score,budget_reason,cycle_score,cycle_reason,contact_name,contact_title,personal_reach_method,email,phone,linkedin_person_search_url,reachability_status,source_urls,outreach_zh_around_200_chars
1,香港,Blue Pool Capital,A,36,10,"Joe Tsai 家族办公室资产、PE、体育资产、消费科技投资并存，多币种与非标资产报告复杂度极高。",8,"Oliver Weisberg 为 CEO/投资负责人，有明确个人姓名和高可信 LinkedIn 检索入口；需 Apollo/Hunter 补个人邮箱。",10,"公开资料显示管理 Tsai 家族办公室及数十亿美元级资产，财富科技预算能力强。",8,"机构化扩张和外部基金化提升报表、LP与家族资产分层需求。",Oliver Weisberg,CEO / investment lead,LinkedIn personal search,,,https://www.linkedin.com/search/results/people/?keywords=Oliver%20Weisberg%20Blue%20Pool%20Capital,person_name_plus_linkedin_search_needs_profile_confirmation,https://www.wsj.com/finance/investing/blue-pool-capital-raises-1-billion-for-first-private-equity-fund-2091966d | https://www.ft.com/content/42ccc0ea-4812-44bf-978a-f56c966f2711,"Oliver 你好，Blue Pool 从 Joe Tsai 家族办公室延展到更机构化的多策略与私募投资，资产横跨体育、消费、科技和全球基金。Canopy 可把多托管行、基金管理人、直接投资和运营资产数据汇总成统一视图，减少 Excel 对账和多币种报表延迟。若团队正在提升家族资产与外部基金之间的报告效率，我希望安排 15 分钟介绍 Canopy 的适用场景。"
2,香港,Horizons Ventures,B,34,9,"李嘉诚相关科技投资平台，全球 VC/成长投资组合多，估值和持仓更新频繁。",8,"Solina Chau 为核心投资决策人，有明确个人身份与 LinkedIn 检索入口。",9,"长期全球科技投资，资产规模和系统化投后管理预算潜力高。",8,"科技投资组合快速变化，投后数据、估值和跨境报告更新需求持续。",Solina Chau,Co-founder / senior principal,LinkedIn personal search,,,https://www.linkedin.com/search/results/people/?keywords=Solina%20Chau%20Horizons%20Ventures,person_name_plus_linkedin_search_needs_profile_confirmation,https://www.horizonsventures.com/ | https://en.wikipedia.org/wiki/Solina_Chau,"Solina 你好，Horizons 长期围绕全球颠覆性科技公司布局，投资地域和资产阶段都非常分散。Canopy 服务家族资本团队，将银行、券商、基金、私募和直接股权数据整合为同一套实时资产视图，减少手工更新估值和多币种汇总的负担。若 Horizons 正在优化投后数据和家族层面组合报告，我希望约 15 分钟交流 Canopy 如何补充现有流程。"
3,香港,Tsangs Group,A,33,9,"公开定位为家族办公室，投资主题覆盖科技、消费、数字资产、生命科学等。",8,"Patrick Tsang 为主席，有明确个人身份与 LinkedIn 检索入口。",8,"家办平台对外投资活跃，具备购买专业资产聚合工具的预算基础。",8,"跨境项目多，适合从投资运营和家族报告效率切入。",Patrick Tsang,Chairman,LinkedIn personal search,,,https://www.linkedin.com/search/results/people/?keywords=Patrick%20Tsang%20Tsangs%20Group,person_name_plus_linkedin_search_needs_profile_confirmation,https://tsangsgroup.co/,"Patrick 你好，Tsangs Group 以香港家族办公室身份连接亚洲资本与全球创新项目，组合横跨科技、消费、数字资产和生命科学。Canopy 可把多银行、多券商、基金和直接投资数据整合到一个安全仪表盘，减少人工报表和管理人口径差异。若团队正在提升跨境组合监控、现金流和家族成员报告效率，我希望安排 15 分钟线上演示。"
4,香港,RS Group,A,32,8,"影响力投资家族办公室，传统投资与影响力指标并存，报告口径复杂。",8,"Annie Chen 为 founder/chair，有明确个人身份与 LinkedIn 检索入口。",8,"专业家办架构清晰，具备可持续投资和数据透明度预算。",8,"影响力与财务资产并行，适合从报告整合和治理视图切入。",Annie Chen,Founder / Chair,LinkedIn personal search,,,https://www.linkedin.com/search/results/people/?keywords=Annie%20Chen%20RS%20Group%20Hong%20Kong,person_name_plus_linkedin_search_needs_profile_confirmation,https://www.rsgroup.asia/,"Annie 你好，RS Group 在香港家族办公室中以价值观投资和影响力资产配置著称，这类组合通常需要同时追踪财务表现、管理人数据和影响力维度。Canopy 能统一银行、基金、私募和直接项目数据，形成可审计的家族级资产视图。若 RS Group 希望减少手工汇总、提升组合透明度和定期报告效率，我希望安排一次 15 分钟交流。"
5,香港,Morningside Group,B,31,8,"陈氏家族私人投资集团，生命科学、科技、地产和长期投资组合复杂。",7,"Gerald Chan 为家族 principal，有个人检索入口；需进一步确认实际投资办公室联系人。",9,"长期全球投资平台，预算能力强。",7,"决策层级可能较长，建议先从投资运营或 CFO 线索切入。",Gerald Chan,Co-founder / Chairman,LinkedIn personal search,,,https://www.linkedin.com/search/results/people/?keywords=Gerald%20Chan%20Morningside%20Group,person_name_plus_linkedin_search_needs_profile_confirmation,https://www.morningside.com/ | https://en.wikipedia.org/wiki/Gerald_Chan,"Dr. Chan 你好，Morningside 长期在生命科学、科技和地产领域进行全球投资，资产具有长期、非标、跨地域的特点。Canopy 可帮助家族资本团队把银行、券商、基金、私募和直接股权数据统一到一个视图，便于家族成员、投资团队和顾问看到一致口径。若 Morningside 正在优化投资组合报告与估值更新流程，我希望安排一次简短演示。"
6,香港,Pacific Century Group,B,31,8,"Richard Li 私人投资集团覆盖保险、科技、媒体、地产和金融服务，资产类别多元。",7,"Richard Li 为家族 principal；个人 LinkedIn 检索入口可用，需补办公室实际联系人。",9,"资产规模和跨行业复杂度高，预算能力强。",7,"家族层面可能需多级审批，建议暖介绍主席办公室或投资负责人。",Richard Li,Chairman,LinkedIn personal search,,,https://www.linkedin.com/search/results/people/?keywords=Richard%20Li%20Pacific%20Century%20Group,person_name_plus_linkedin_search_needs_profile_confirmation,http://www.pcg-group.com/ | https://en.wikipedia.org/wiki/Pacific_Century_Group,"Richard 你好，Pacific Century Group 横跨金融服务、保险、科技、媒体和地产，家族资本视角下的数据来源和报告口径天然复杂。Canopy 可统一多托管行、券商、基金、私募和直接投资数据，形成跨币种、跨实体的资产总览。若 PCG 相关家族资本团队正在提升资产透明度和定期报告效率，我希望安排 15 分钟沟通。"
7,大陆,Fosun / Guo Family Capital Equivalent,C,30,8,"复星全球产业和投资布局多元，金融、医药、消费、地产与基金资产复杂。",7,"郭广昌为明确个人 principal；LinkedIn 检索入口可用，需验证家族办公室实际联系人。",9,"资产体量和全球化程度高，预算能力强。",6,"集团化采购链较长，建议先验证主席办公室或家族资本团队。",Guo Guangchang,Chairman / family principal,LinkedIn personal search,,,https://www.linkedin.com/search/results/people/?keywords=Guo%20Guangchang%20Fosun,person_name_plus_linkedin_search_needs_profile_confirmation,https://www.fosun.com/ | https://en.wikipedia.org/wiki/Guo_Guangchang,"郭总您好，复星长期进行全球化产业和投资布局，横跨医药、消费、金融和资产管理等领域。Canopy 能把多银行、多券商、基金、私募和直接投资数据统一到家族资本视图中，帮助减少分散报表和人工对账。若郭氏家族资本或主席办公室希望提升资产透明度、风险汇总和跨币种报告效率，我希望安排一次 15 分钟交流。"
8,大陆,New Hope Group / Liu Family Capital Equivalent,C,29,7,"刘氏家族产业、金融投资、农业食品和多元资产并存，潜在家族资本汇总需求强。",7,"刘永好为明确个人 principal；LinkedIn 检索入口可用，需补实际投资办公室联系人。",8,"家族产业资产大，具备系统化预算。",7,"若先找到投资办公室或家办负责人，转化效率会明显提升。",Liu Yonghao,Chairman / family principal,LinkedIn personal search,,,https://www.linkedin.com/search/results/people/?keywords=Liu%20Yonghao%20New%20Hope%20Group,person_name_plus_linkedin_search_needs_profile_confirmation,https://en.newhopegroup.com/ | https://en.wikipedia.org/wiki/Liu_Yonghao,"刘总您好，新希望集团横跨农业食品、金融投资和多元产业，家族资本与经营资产之间需要清晰、持续的资产视图。Canopy 可整合多银行、券商、基金、私募和直接投资数据，减少 Excel 汇总和多币种报表延迟。若新希望家族资本团队正在优化跨实体资产报告和顾问协作，我希望安排一次 15 分钟线上交流。"
9,大陆,East Hope Group / Liu Family Capital Equivalent,C,28,7,"东方希望重资产产业和控股资产规模大，家族层面资产汇总复杂。",6,"刘永行为明确 principal，但公开个人触达弱，需 Apollo/Hunter 补邮箱或 LinkedIn 确认。",8,"资产规模大，长期资本治理预算存在。",7,"需要先验证是否有独立家族投资办公室。",Liu Yongxing,Founder / Chairman,LinkedIn personal search,,,https://www.linkedin.com/search/results/people/?keywords=Liu%20Yongxing%20East%20Hope%20Group,person_name_plus_linkedin_search_needs_profile_confirmation,https://www.easthope.cn/ | https://en.wikipedia.org/wiki/Liu_Yongxing,"刘总您好，东方希望长期经营重资产产业和多元控股业务，家族层面的资产、现金流、投资项目和外部金融资产很可能分布在不同实体和系统中。Canopy 专注帮助家族办公室建立统一资产聚合与报告平台，降低手工整理和跨实体汇总压力。若家族资本团队有提升资产透明度的计划，我希望安排 15 分钟沟通。"
10,大陆,Fu Wah International Group / Chan Family Platform,C,27,7,"富华家族地产、文化和投资资产并存，适合验证家族资产管理数字化需求。",6,"陈丽华为明确 principal，但个人级触达需进一步补强。",8,"家族资产体量大，预算能力存在。",6,"决策链较长，建议通过主席办公室或顾问渠道暖介绍。",Chan Laiwa,Founder / Chair,LinkedIn personal search,,,https://www.linkedin.com/search/results/people/?keywords=Chan%20Laiwa%20Fu%20Wah%20International%20Group,person_name_plus_linkedin_search_needs_profile_confirmation,https://www.fuwahgroup.com/ | https://en.wikipedia.org/wiki/Chan_Laiwa,"陈女士您好，富华国际集团长期覆盖地产、文化和多元投资，家族资产与企业资产之间的汇总、估值和报告需要清晰治理工具。Canopy 可为家族办公室整合银行、券商、基金、私募和直接项目数据，形成统一资产视图。若富华家族平台希望提升资产管理效率和顾问协作，我希望安排一次 15 分钟交流。"
11,大陆,Wanda Group / Wang Family Platform,C,26,6,"万达资产经历地产、文旅、院线和多元投资调整，资产治理需求可能存在。",6,"王健林为明确 principal；需验证家族资本团队实际联系人。",8,"资产体量大，但近期集团重组可能影响预算节奏。",6,"更适合通过熟人/银行渠道验证后跟进。",Wang Jianlin,Chairman / family principal,LinkedIn personal search,,,https://www.linkedin.com/search/results/people/?keywords=Wang%20Jianlin%20Wanda%20Group,person_name_plus_linkedin_search_needs_profile_confirmation,https://www.wanda-group.com/ | https://en.wikipedia.org/wiki/Wang_Jianlin,"王总您好，万达集团长期涉及地产、文旅、院线和多元投资，家族层面的资产视图、现金流跟踪和外部金融资产汇总需要稳定数据基础。Canopy 面向家族办公室和私人投资平台，帮助统一托管行、券商、基金和直接投资数据，降低手工报表负担。若相关家族资本团队正在提升资产透明度，我希望安排 15 分钟介绍。"
12,大陆,BYD / Wang Family Capital Equivalent,C,25,6,"王传福家族财富主要来自产业股权，若存在外部金融资产和家族办公室则有聚合需求。",6,"王传福为明确 principal；需 Apollo/Hunter 找家办或投资办公室联系人。",8,"财富规模高，但家族办公室预算主体不公开。",5,"当前更像待验证线索，需先确认家族资本团队。",Wang Chuanfu,Chairman / family principal,LinkedIn personal search,,,https://www.linkedin.com/search/results/people/?keywords=Wang%20Chuanfu%20BYD,person_name_plus_linkedin_search_needs_profile_confirmation,https://www.bydglobal.com/ | https://en.wikipedia.org/wiki/Wang_Chuanfu,"王总您好，比亚迪长期高速发展，家族财富和产业股权价值庞大，若家族层面同时配置外部金融资产、基金或跨境投资，统一报告和风险汇总会变得关键。Canopy 可帮助家族资本团队整合多机构资产数据，形成实时组合视图。若相关办公室正在建立更系统化的资产报告流程，我希望安排 15 分钟交流。"
13,台湾,Fubon Financial / Tsai Family Platform,C,29,7,"蔡氏家族金融控股体系庞大，金融资产、地产与家族治理场景明显。",7,"Daniel Tsai 为明确 principal；个人 LinkedIn 检索入口可用，需补邮箱。",8,"金融控股背景强，财富科技预算潜力高。",7,"金融体系内采购规范，需找家族资本或主席办公室实际联系人。",Daniel Tsai,Chairman / family principal,LinkedIn personal search,,,https://www.linkedin.com/search/results/people/?keywords=Daniel%20Tsai%20Fubon%20Financial,person_name_plus_linkedin_search_needs_profile_confirmation,https://www.fubon.com/financialholdings/en/ | https://en.wikipedia.org/wiki/Tsai_Ming-chung,"蔡先生您好，富邦体系横跨银行、保险、证券和资产管理，家族层面的金融资产与长期控股结构非常复杂。Canopy 服务家族办公室，能整合多银行、多券商、基金、私募和直接投资数据，形成统一资产视图。若蔡氏家族资本团队希望提升跨实体资产报告、顾问协作和多币种汇总效率，我希望安排一次 15 分钟交流。"
14,台湾,Cathay Financial / Lin Yuan Group Family Platform,C,29,7,"霖园蔡氏家族金融、保险、地产和投资资产复杂，合并报告场景强。",7,"Tsai Hong-tu 为明确 principal；LinkedIn 检索入口可用，需补实际办公室联系人。",8,"金融控股与家族资产体量大，预算能力强。",7,"需通过家族办公室/主席办公室验证采购路径。",Tsai Hong-tu,Chairman / family principal,LinkedIn personal search,,,https://www.linkedin.com/search/results/people/?keywords=Tsai%20Hong-tu%20Cathay%20Financial,person_name_plus_linkedin_search_needs_profile_confirmation,https://www.cathayholdings.com/en/ | https://en.wikipedia.org/wiki/Tsai_Hong-tu,"蔡先生您好，国泰与霖园体系长期覆盖保险、银行、地产和投资资产，家族层面的资产汇总、风险视图和跨实体报告天然复杂。Canopy 可帮助家族办公室统一不同金融机构、管理人、私募和直接持股数据。若家族资本团队正在考虑更现代化的资产聚合工具，我希望安排一次 15 分钟交流。"
15,台湾,Ruentex Group / Samuel Yin Family Platform,C,28,7,"润泰体系地产、零售、金融投资和公益资产并存，长期资本治理需求明显。",7,"Samuel Yin 为明确 principal；LinkedIn 检索入口可用。",8,"资产规模和公益基金会治理预算潜力较高。",6,"需先确认投资办公室联系人，直接触达 principal 周期较长。",Samuel Yin,Founder / Chairman,LinkedIn personal search,,,https://www.linkedin.com/search/results/people/?keywords=Samuel%20Yin%20Ruentex,person_name_plus_linkedin_search_needs_profile_confirmation,https://www.ruentex.com.tw/ | https://en.wikipedia.org/wiki/Samuel_Yin,"尹先生您好，润泰体系横跨地产、零售、投资和公益项目，长期资产与流动金融资产之间的汇总和治理需要可靠数据基础。Canopy 专注为家族办公室提供资产聚合、跨机构数据整合和家族级投资报告，减少手工更新和口径不一致。若润泰家族平台正在提升投资运营效率，我希望安排 15 分钟沟通。"
16,台湾,Pou Chen Group / Tsai Family Platform,C,26,6,"宝成集团全球制造和投资资产多市场、多币种，潜在家族资本需求存在。",6,"蔡氏家族联系人需进一步确认，本表以 chair office 个人线索待补充。",8,"家族资产规模大，但独立家办主体不公开。",6,"需先用 Apollo/Hunter 找投资办公室具体负责人。",Tsai Family Chair Office,Family capital / chair office lead needed,LinkedIn personal search,,,https://www.linkedin.com/search/results/people/?keywords=Pou%20Chen%20Group%20Tsai%20family%20investment,person_name_plus_linkedin_search_needs_profile_confirmation,https://www.pouchen.com/ | https://en.wikipedia.org/wiki/Pou_Chen_Corporation,"您好，宝成集团在全球制造、品牌供应链和投资布局上具有多市场、多币种和多实体特点，家族资本视角下的资产汇总与报表协调会非常复杂。Canopy 可整合银行、券商、基金、私募和直接投资数据，形成一致的家族级资产总览。若宝成家族资本或董事长办公室正在优化投资数据管理，我希望安排 15 分钟交流。"
17,台湾,Want Want China / Tsai Family Platform,C,25,6,"旺旺家族消费品、媒体和跨境经营资产明显，外部金融资产需验证。",6,"Tsai Eng-meng 为明确 principal；个人触达需进一步验证。",8,"财富规模较高，但采购主体不清晰。",5,"争议和决策链因素较多，建议低优先级验证。",Tsai Eng-meng,Chairman / family principal,LinkedIn personal search,,,https://www.linkedin.com/search/results/people/?keywords=Tsai%20Eng-meng%20Want%20Want,person_name_plus_linkedin_search_needs_profile_confirmation,https://www.want-want.com/ | https://en.wikipedia.org/wiki/Tsai_Eng-meng,"蔡先生您好，旺旺集团在消费品、媒体和跨境经营上有长期布局，家族资本与经营资产之间的总览、现金流和外部投资报告通常需要统一口径。Canopy 面向家族办公室，帮助整合多银行、多券商、基金和直接投资数据。若旺旺家族资本团队希望减少手工报表并提高资产透明度，我希望安排 15 分钟交流。"
18,台湾,Formosa Plastics / Wang Family Platform,C,24,6,"王氏家族产业资产巨大，但外部家族办公室和金融资产配置公开证据较弱。",5,"需进一步确认具体家族资本负责人；当前只有 family principal 级别线索。",8,"财富规模高，预算能力存在。",5,"需先验证独立家办，否则不建议直接销售触达。",Wang Family Office Lead Needed,Family capital lead needed,LinkedIn personal search,,,https://www.linkedin.com/search/results/people/?keywords=Formosa%20Plastics%20Wang%20family%20office,person_name_plus_linkedin_search_needs_profile_confirmation,https://www.fpg.com.tw/ | https://en.wikipedia.org/wiki/Formosa_Plastics_Group,"您好，台塑体系代表台湾最重要的家族产业资产之一，若王氏家族层面同时管理外部金融资产、基金、地产或跨境投资，统一资产视图会很关键。Canopy 可帮助家族资本团队整合多机构数据，减少 Excel 汇总和多币种报表压力。若相关家族办公室或投资团队正在建立更系统化报告流程，我希望安排一次简短交流。"
19,泰国,Charoen Pokphand Group / Chearavanont Family Platform,C,32,8,"谢氏家族资产横跨农业食品、零售、电信、金融和全球投资，复杂度极高。",7,"Suphachai Chearavanont 为明确家族 principal；LinkedIn 检索入口可用。",9,"资产体量和专业团队成熟度高，预算能力强。",8,"跨境和多产业资产带来持续报告需求，但需找家族资本团队。",Suphachai Chearavanont,CEO / family principal,LinkedIn personal search,,,https://www.linkedin.com/search/results/people/?keywords=Suphachai%20Chearavanont%20CP%20Group,person_name_plus_linkedin_search_needs_profile_confirmation,https://www.cpgroupglobal.com/ | https://en.wikipedia.org/wiki/Suphachai_Chearavanont,"Suphachai 你好，CP Group 横跨农业食品、零售、电信、金融和全球投资，家族资本层面的数据来源与资产口径非常复杂。Canopy 可把银行、券商、基金、私募、直接投资和多币种资产统一到一个实时视图，减少人工对账和分散报表。若 Chearavanont family capital team 正在优化家族投资报告，我希望安排 15 分钟交流。"
20,泰国,Central Group / Chirathivat Family Platform,C,31,8,"Chirathivat 家族零售、地产、酒店和海外资产丰富，跨实体报告需求强。",7,"Tos Chirathivat 为明确 principal；LinkedIn 检索入口可用。",9,"家族资产和跨境扩张显著，预算能力强。",7,"采购链较长，建议通过投资或主席办公室切入。",Tos Chirathivat,Executive Chairman / family principal,LinkedIn personal search,,,https://www.linkedin.com/search/results/people/?keywords=Tos%20Chirathivat%20Central%20Group,person_name_plus_linkedin_search_needs_profile_confirmation,https://www.centralgroup.com/ | https://en.wikipedia.org/wiki/Central_Group,"Tos 你好，Central Group 在零售、地产、酒店和海外资产上持续扩张，家族层面的投资组合、现金流和跨实体报告很容易分散在多个系统中。Canopy 可以统一托管行、券商、基金、私募和直接投资数据，建立清晰的资产总览。若 Chirathivat family office 或投资团队希望提升数据整合效率，我希望安排 15 分钟沟通。"
21,泰国,TCC Group / Sirivadhanabhakdi Family Platform,C,31,8,"苏旭明家族资产覆盖 ThaiBev、地产、酒店、消费和跨境投资，组合复杂。",7,"Panote 为家族二代核心管理者，个人检索入口可用。",9,"资产体量大且多元，预算能力强。",7,"需验证家族资本团队联系人，建议暖介绍。",Panote Sirivadhanabhakdi,Group CEO / family principal,LinkedIn personal search,,,https://www.linkedin.com/search/results/people/?keywords=Panote%20Sirivadhanabhakdi%20TCC%20Group,person_name_plus_linkedin_search_needs_profile_confirmation,https://www.tcc.co.th/ | https://www.thaibev.com/ | https://en.wikipedia.org/wiki/Charoen_Sirivadhanabhakdi,"Panote 你好，TCC 及相关平台覆盖消费、地产、酒店和跨境投资，家族层面需要同时看经营资产、金融投资和长期控股表现。Canopy 可统一不同银行、券商、基金管理人和直接项目数据，支持跨币种、跨实体定期报告。若 Sirivadhanabhakdi family capital team 正在提升资产透明度，我希望安排 15 分钟交流。"
22,泰国,DTGO / Chearavanont Family Platform,B,30,8,"DTGO 结合地产、投资和社会影响力资产，家族治理与影响力报告并存。",7,"Thippaporn 为 founder/CEO，个人检索入口可用。",8,"家族平台成熟，有数字化和影响力资产预算潜力。",7,"价值观投资与地产组合适合从报告透明度切入。",Thippaporn Ahriyavraromp,Founder / Group CEO,LinkedIn personal search,,,https://www.linkedin.com/search/results/people/?keywords=Thippaporn%20Ahriyavraromp%20DTGO,person_name_plus_linkedin_search_needs_profile_confirmation,https://www.dtgo.com/,"Thippaporn 你好，DTGO 将地产、投资和社会影响力目标结合，既有长期资产管理，也有家族价值观和影响力呈现需求。Canopy 能整合多银行、多管理人、私募和直接投资数据，形成统一的资产、现金流和报告视图。若 DTGO 希望进一步数字化投资组合透明度，我希望安排 15 分钟交流。"
23,泰国,Srivikorn Group,A,29,7,"Srivikorn 作为家族投资平台，涉及地产、消费、科技和长期投资。",8,"Khan Srivikorn 为家族 principal，个人检索入口明确。",7,"资产规模较大型家族略低，但家办 SaaS 适配度好。",7,"决策链可能更短，适合直接 LinkedIn + 邮件测试。",Khan Srivikorn,Chairman / family principal,LinkedIn personal search,,,https://www.linkedin.com/search/results/people/?keywords=Khan%20Srivikorn%20Srivikorn%20Group,person_name_plus_linkedin_search_needs_profile_confirmation,https://srivikorn.com/,"Khan 你好，Srivikorn Group 作为家族资本平台，长期投资地产、消费和创新企业，组合类型多元且需要持续跟踪。Canopy 可把银行、券商、基金、私募和直接投资数据整合到一个仪表盘，减少人工报表和管理人数据口径差异。若 Srivikorn family office 正在优化投资运营或家族成员报告，我希望安排 15 分钟交流。"
